{
  "$schema": "../../design-contracts/schemas/token-source.schema.json",
  "schemaVersion": 1,
  "sourceId": "menq.design.token-source.core.v1",
  "decision": "D-025",
  "status": "Approved — Implementing",
  "canonicalLanguages": ["hy", "en"],
  "generatedOutputsAreCanonical": false,
  "tokens": [
    {
      "id": "menq.design.token.reference.color.neutral.0",
      "layer": "Reference",
      "type": "color",
      "description": { "hy": "Չեզոք բացագույն reference արժեք", "en": "Lightest neutral reference value" },
      "ownerId": "owner.design-platform-maintainer",
      "lifecycle": "Approved — Implementing",
      "value": "#ffffff"
    },
    {
      "id": "menq.design.token.reference.color.neutral.1000",
      "layer": "Reference",
      "type": "color",
      "description": { "hy": "Չեզոք մուգ reference արժեք", "en": "Darkest neutral reference value" },
      "ownerId": "owner.design-platform-maintainer",
      "lifecycle": "Approved — Implementing",
      "value": "#0b0d10"
    },
    {
      "id": "menq.design.token.reference.dimension.space.2",
      "layer": "Reference",
      "type": "dimension",
      "description": { "hy": "Հիմնական փոքր spacing reference արժեք", "en": "Base small spacing reference value" },
      "ownerId": "owner.design-platform-maintainer",
      "lifecycle": "Approved — Implementing",
      "value": "8px"
    },
    {
      "id": "menq.design.token.reference.dimension.radius.2",
      "layer": "Reference",
      "type": "dimension",
      "description": { "hy": "Հիմնական միջին radius reference արժեք", "en": "Base medium radius reference value" },
      "ownerId": "owner.design-platform-maintainer",
      "lifecycle": "Approved — Implementing",
      "value": "12px"
    },
    {
      "id": "menq.design.token.semantic.surface.canvas",
      "layer": "Semantic",
      "type": "color",
      "description": { "hy": "Հիմնական canvas մակերեսի իմաստային գույն", "en": "Semantic color for the primary canvas surface" },
      "ownerId": "owner.design-platform-maintainer",
      "lifecycle": "Approved — Implementing",
      "reference": "menq.design.token.reference.color.neutral.0"
    },
    {
      "id": "menq.design.token.semantic.content.primary",
      "layer": "Semantic",
      "type": "color",
      "description": { "hy": "Հիմնական բովանդակության իմաստային գույն", "en": "Semantic color for primary content" },
      "ownerId": "owner.design-platform-maintainer",
      "lifecycle": "Approved — Implementing",
      "reference": "menq.design.token.reference.color.neutral.1000"
    },
    {
      "id": "menq.design.token.semantic.space.inline",
      "layer": "Semantic",
      "type": "dimension",
      "description": { "hy": "Inline տարրերի հիմնական բացվածք", "en": "Default spacing between inline elements" },
      "ownerId": "owner.design-platform-maintainer",
      "lifecycle": "Approved — Implementing",
      "reference": "menq.design.token.reference.dimension.space.2"
    },
    {
      "id": "menq.design.token.component.card.radius",
      "layer": "Component",
      "type": "dimension",
      "description": { "hy": "Card component-ի canonical radius mapping", "en": "Canonical radius mapping for the Card component" },
      "ownerId": "owner.design-platform-maintainer",
      "lifecycle": "Approved — Implementing",
      "reference": "menq.design.token.reference.dimension.radius.2"
    }
  ]
}
